{
  "schemaVersion": "1.0.0",
  "slug": "generated-open-source-seo-content-workflow",
  "brief": {
    "keyword": "open source SEO content workflow",
    "intent": "mixed",
    "audience": "SEO operators, affiliate site builders, and developers evaluating open-source AI writing workflows",
    "angle": "Open, inspectable Super Page workflow for open source SEO content workflow. Desired action: review and improve the page before publishing; Target location: global/default; Brand voice: helpful expert; Image model: default mock/live adapter",
    "sourceModel": "mock-codex5.5pro"
  },
  "metadata": {
    "title": "Open Source SEO Content Workflow: Inspectable SEO Super Page Workflow",
    "description": "A generated Super Page workflow for open source SEO content workflow with structure, block rewrites, image prompts, and quality checks.",
    "canonicalUrl": "https://example.com/articles/generated-open-source-seo-content-workflow",
    "updatedAt": "2026-04-28",
    "author": "Boundless Agent Labs",
    "openGraph": {
      "title": "Open Source SEO Content Workflow: Inspectable SEO Super Page Workflow",
      "description": "A generated Super Page workflow for open source SEO content workflow with structure, block rewrites, image prompts, and quality checks.",
      "image": "/mock-images/ai-seo-super-page-hero.svg"
    }
  },
  "hero": {
    "headline": "Build a Super Page for Open Source SEO Content Workflow",
    "answer": "This persisted workflow turns open source SEO content workflow into a structured Super Page plan with generated sections, image prompts, quality checks, and operator instructions: Desired action: review and improve the page before publishing; Target location: global/default; Brand voice: helpful expert; Image model: default mock/live adapter.",
    "summaryBullets": [
      "Topic-specific structure for open source SEO content workflow",
      "Section rewrites stay linked to source notes and constraints",
      "Image prompt metadata is persisted with QA state",
      "Quality and SEO validation are visible before preview"
    ],
    "trustCue": "Research prototype updated on 2026-04-28 with explicit quality gates and mock generation evidence."
  },
  "toc": [
    {
      "id": "structure-first",
      "label": "Structure the Open Source SEO Content Workflow Super Page"
    },
    {
      "id": "block-rewriting",
      "label": "Rewrite each block with context and constraints"
    },
    {
      "id": "image-quality",
      "label": "Make image generation part of the article plan"
    },
    {
      "id": "quality-gates",
      "label": "Show quality gates before publishing"
    }
  ],
  "sections": [
    {
      "id": "structure-first",
      "heading": "Structure the Open Source SEO Content Workflow Super Page",
      "searchIntent": "Understand what a useful open source SEO content workflow Super Page should cover before drafting.",
      "summaryClaim": "A schema makes the page inspectable and prevents the writer from producing an unstructured wall of SEO text.",
      "paragraphs": [
        "A schema makes the page inspectable and prevents the writer from producing an unstructured wall of SEO text. Useful SEO pages should add original value, clear structure, and satisfying explanations instead of search-first filler. Applied to the submitted topic: open source SEO content workflow. Desired action: review and improve the page before publishing; Target location: global/default; Brand voice: helpful expert; Image model: default mock/live adapter. This rewrite stays focused on understand what a useful open source seo content workflow super page should cover before drafting. while adding specific example, practical caveat, reader benefit.",
        "For implementation, the editor sees why this block exists, which claims are grounded, and which caveats remain. This keeps retries local to the section instead of regenerating the entire article."
      ],
      "examples": [
        "For a software comparison page, the schema can require a decision table, best-for labels, caveats, and a final recommendation checklist."
      ],
      "caveats": [
        "The schema should guide quality without forcing every keyword into the same rigid layout."
      ],
      "imageSlotId": "hero-workflow",
      "qualityNotes": [
        "Mock rewrite used 2 source notes and 3 must-include constraints."
      ],
      "sourceNotes": [
        {
          "label": "Google people-first baseline",
          "note": "Useful SEO pages should add original value, clear structure, and satisfying explanations instead of search-first filler. Applied to the submitted topic: open source SEO content workflow. Desired action: review and improve the page before publishing; Target location: global/default; Brand voice: helpful expert; Image model: default mock/live adapter.",
          "sourceType": "research"
        },
        {
          "label": "Product workflow assumption",
          "note": "Editors need inspectable blocks so weak sections, unsupported claims, and image issues can be retried independently. Applied to the submitted topic: open source SEO content workflow. Desired action: review and improve the page before publishing; Target location: global/default; Brand voice: helpful expert; Image model: default mock/live adapter.",
          "sourceType": "assumption"
        }
      ],
      "generationConstraints": {
        "mustInclude": [
          "specific example",
          "practical caveat",
          "reader benefit"
        ],
        "avoidPhrases": [
          "In today's digital age",
          "unlock the power",
          "delve into",
          "game changer"
        ],
        "claimPolicy": "Do not invent statistics, rankings, quotes, studies, or dates unless they appear in source notes.",
        "citationPolicy": "If a paragraph makes a factual external claim, keep it source-grounded or mark it for research instead of fabricating a citation."
      }
    },
    {
      "id": "block-rewriting",
      "heading": "Rewrite each block with context and constraints",
      "searchIntent": "The reader wants a practical way to make AI content feel less generic.",
      "summaryClaim": "Independent block rewriting makes it easier to add examples, caveats, and source notes without repeating the same AI cadence.",
      "paragraphs": [
        "Independent block rewriting makes it easier to add examples, caveats, and source notes without repeating the same AI cadence. Useful SEO pages should add original value, clear structure, and satisfying explanations instead of search-first filler. Applied to the submitted topic: open source SEO content workflow. Desired action: review and improve the page before publishing; Target location: global/default; Brand voice: helpful expert; Image model: default mock/live adapter. This rewrite stays focused on the reader wants a practical way to make ai content feel less generic. while adding specific example, practical caveat, reader benefit.",
        "For implementation, the editor sees why this block exists, which claims are grounded, and which caveats remain. This keeps retries local to the section instead of regenerating the entire article."
      ],
      "examples": [
        "A section about image quality can require one concrete artifact checklist: distorted hands, unreadable text, plastic textures, impossible reflections, and generic stock-photo framing."
      ],
      "caveats": [
        "Block rewriting still needs source discipline; smaller prompts do not automatically make factual claims reliable."
      ],
      "imageSlotId": "section-editor",
      "qualityNotes": [
        "Mock rewrite used 2 source notes and 3 must-include constraints."
      ],
      "sourceNotes": [
        {
          "label": "Google people-first baseline",
          "note": "Useful SEO pages should add original value, clear structure, and satisfying explanations instead of search-first filler. Applied to the submitted topic: open source SEO content workflow. Desired action: review and improve the page before publishing; Target location: global/default; Brand voice: helpful expert; Image model: default mock/live adapter.",
          "sourceType": "research"
        },
        {
          "label": "Product workflow assumption",
          "note": "Editors need inspectable blocks so weak sections, unsupported claims, and image issues can be retried independently. Applied to the submitted topic: open source SEO content workflow. Desired action: review and improve the page before publishing; Target location: global/default; Brand voice: helpful expert; Image model: default mock/live adapter.",
          "sourceType": "assumption"
        }
      ],
      "generationConstraints": {
        "mustInclude": [
          "specific example",
          "practical caveat",
          "reader benefit"
        ],
        "avoidPhrases": [
          "In today's digital age",
          "unlock the power",
          "delve into",
          "game changer"
        ],
        "claimPolicy": "Do not invent statistics, rankings, quotes, studies, or dates unless they appear in source notes.",
        "citationPolicy": "If a paragraph makes a factual external claim, keep it source-grounded or mark it for research instead of fabricating a citation."
      }
    },
    {
      "id": "image-quality",
      "heading": "Make image generation part of the article plan",
      "searchIntent": "The reader wants to know how image prompts can improve SEO content quality and user trust.",
      "summaryClaim": "Article images should explain the topic or demonstrate a workflow, not merely decorate the page.",
      "paragraphs": [